{
  "id": "78",
  "title": "Descriptive Statistics Calculator",
  "difficulty": "easy",
  "category": "Statistics",
  "video": "",
  "likes": "0",
  "dislikes": "0",
  "contributor": [
    {
      "profile_link": "https://github.com/BhardwajArjit",
      "name": "Arjit Bhardwaj"
    }
  ],
  "description": "Write a Python function to calculate various descriptive statistics metrics for a given dataset. The function should take a list or NumPy array of numerical values and return a dictionary containing mean, median, mode, variance, standard deviation, percentiles (25th, 50th, 75th), and interquartile range (IQR).",
  "learn_section": "## Understanding Descriptive Statistics\n\nDescriptive statistics provide a summary of data through various measures and help understand the basic structure and distribution of data.\n\n### Key Metrics\n\nDescriptive statistics cover several key metrics, including mean, median, mode, variance, standard deviation, percentiles, quartiles, and interquartile range.\n\n- **Mean**: The average of all values in the dataset, calculated by summing all the values and dividing by the count of values.\n- **Median**: The middle value when the data is sorted. If there is an even number of values, the median is the average of the two middle values.\n- **Mode**: The value that occurs most frequently in the dataset.\n- **Variance**: A measure of how much the values in the dataset deviate from the mean, calculated as:\n  $$\n  \\text{Variance} = \\frac{\\sum (x_i - \\bar{x})^2}{N}\n  $$\n  where \\(x_i\\) are the data points, \\(\\bar{x}\\) is the mean, and \\(N\\) is the number of data points.\n- **Standard Deviation**: The square root of the variance, calculated as:\n  $$\n  \\text{Standard Deviation} = \\sqrt{\\frac{\\sum (x_i - \\bar{x})^2}{N}}\n  $$\n- **Percentiles and Quartiles**: Percentiles divide the data into 100 equal parts, while quartiles divide the data into four equal parts. The 25th, 50th (median), and 75th percentiles are the common quartiles.\n- **Interquartile Range (IQR)**: The difference between the 75th and 25th percentiles, calculated as:\n  $$\n  \\text{IQR} = Q_3 - Q_1\n  $$\n  where \\(Q_3\\) is the 75th percentile and \\(Q_1\\) is the 25th percentile.\n\n### Example Calculation\n\nGiven data:\n\nData set: \\([12, 15, 12, 18, 19, 17, 15, 14, 16, 18]\\)\n\n- **Mean**:\n  $$\n  \\text{Mean} = \\frac{\\sum x_i}{N} = \\frac{156}{10} = 15.6\n  $$\n- **Median**:\n  $$\n  \\text{Median} = 15.5\n  $$\n- **Mode**:\n  $$\n  \\text{Mode} = 12, 15, 18\n  $$\n- **Variance**:\n  $$\n  \\text{Variance} = \\frac{\\sum (x_i - 15.6)^2}{9} \\approx 6.93\n  $$\n- **Standard Deviation**:\n  $$\n  \\text{Standard Deviation} = \\sqrt{6.93} \\approx 2.63\n  $$\n- **Percentiles**:\n  $$\n  25\\% \\text{ Percentile} = 13.5, \\quad 50\\% \\text{ Percentile} = 15.5 ,\\quad 75\\% \\text{ Percentile} = 17.5\n  $$\n- **Interquartile Range**:\n  $$\n  \\text{IQR} = 17.5 - 13.5 = 4\n  $$\n\n### Applications\n\nDescriptive statistics are widely used in:\n\n- Data Analysis\n- Exploratory Data Analysis (EDA)\n- Understanding Data Distributions\n- Feature Engineering\n- Identifying Outliers\n\nThese metrics are foundational in data science, helping to interpret data and prepare it for further analysis in machine learning.",
  "starter_code": "import numpy as np \ndef descriptive_statistics(data):\n\t# Your code here\n\tstats_dict = {\n        \"mean\": mean,\n        \"median\": median,\n        \"mode\": mode,\n        \"variance\": np.round(variance,4),\n        \"standard_deviation\": np.round(std_dev,4),\n        \"25th_percentile\": percentiles[0],\n        \"50th_percentile\": percentiles[1],\n        \"75th_percentile\": percentiles[2],\n        \"interquartile_range\": iqr\n    }\n\treturn {}",
  "solution": "import numpy as np\n\ndef descriptive_statistics(data):\n    \"\"\"\n    Calculate various descriptive statistics metrics for a given dataset.\n    :param data: List or numpy array of numerical values\n    :return: Dictionary containing mean, median, mode, variance, standard deviation,\n             percentiles (25th, 50th, 75th), and interquartile range (IQR)\n    \"\"\"\n    # Ensure data is a numpy array for easier calculations\n    data = np.array(data)\n\n    # Mean\n    mean = np.mean(data)\n\n    # Median\n    median = np.median(data)\n\n    # Mode\n    unique, counts = np.unique(data, return_counts=True)\n    mode = unique[np.argmax(counts)] if len(data) > 0 else None\n\n    # Variance\n    variance = np.var(data)\n\n    # Standard Deviation\n    std_dev = np.sqrt(variance)\n\n    # Percentiles (25th, 50th, 75th)\n    percentiles = np.percentile(data, [25, 50, 75])\n\n    # Interquartile Range (IQR)\n    iqr = percentiles[2] - percentiles[0]\n\n    # Compile results into a dictionary\n    stats_dict = {\n        \"mean\": mean,\n        \"median\": median,\n        \"mode\": mode,\n        \"variance\": np.round(variance,4),\n        \"standard_deviation\": np.round(std_dev,4),\n        \"25th_percentile\": percentiles[0],\n        \"50th_percentile\": percentiles[1],\n        \"75th_percentile\": percentiles[2],\n        \"interquartile_range\": iqr\n    }\n\n    return stats_dict",
  "example": {
    "input": "[10, 20, 30, 40, 50]",
    "output": "{'mean': 30.0, 'median': 30.0, 'mode': 10, 'variance': 200.0, 'standard_deviation': 14.142135623730951, '25th_percentile': 20.0, '50th_percentile': 30.0, '75th_percentile': 40.0, 'interquartile_range': 20.0}",
    "reasoning": "The dataset is processed to calculate all descriptive statistics. The mean is the average value, the median is the central value, the mode is the most frequent value, and variance and standard deviation measure the spread of data. Percentiles and IQR describe data distribution."
  },
  "test_cases": [
    {
      "test": "print(descriptive_statistics([10, 20, 30, 40, 50]))",
      "expected_output": "{'mean': 30.0, 'median': 30.0, 'mode': 10, 'variance': 200.0, 'standard_deviation': 14.1421, '25th_percentile': 20.0, '50th_percentile': 30.0, '75th_percentile': 40.0, 'interquartile_range': 20.0}"
    },
    {
      "test": "print(descriptive_statistics([1, 2, 2, 3, 4, 4, 4, 5]))",
      "expected_output": "{'mean': 3.125, 'median': 3.5, 'mode': 4, 'variance': 1.6094, 'standard_deviation': 1.2686, '25th_percentile': 2.0, '50th_percentile': 3.5, '75th_percentile': 4.0, 'interquartile_range': 2.0}"
    },
    {
      "test": "print(descriptive_statistics([100]))",
      "expected_output": "{'mean': 100.0, 'median': 100.0, 'mode': 100, 'variance': 0.0, 'standard_deviation': 0.0, '25th_percentile': 100.0, '50th_percentile': 100.0, '75th_percentile': 100.0, 'interquartile_range': 0.0}"
    }
  ]
}